{
  "schema": "wordpress-hx.adoption-review.v1",
  "schemaVersion": 1,
  "reportId": "acme-calendar.review.1",
  "contract": {
    "id": "acme-calendar.wp70",
    "version": "1.0.0",
    "sha256": "f90da3afc96bd26bcafd70ba215e0360205984799a1bd5b6ee8e3bc308a72a5d"
  },
  "provider": {
    "id": "acme-calendar",
    "version": "2.4.1",
    "artifactSha256": "923412beee77cce43964a12358bb099ac07014bd37973df9910de3ad15b9cabd"
  },
  "generator": {
    "id": "wordpress-hx-adoption-generator",
    "version": "0.0.0-fixture",
    "sha256": "5cc9d0a8c0ba440888de5a06d899002ce83bfe8fa03c752e0d6e8d21476de58b"
  },
  "summary": {
    "discovered": 9,
    "included": 5,
    "omitted": 4,
    "conflicts": 1
  },
  "includedBindings": [
    "js.calendar.badge",
    "js.calendar.format-label",
    "php.calendar.event.construct",
    "php.calendar.event.title",
    "php.calendar.list-events"
  ],
  "omissions": [
    {
      "nativeName": "@acme/calendar.CalendarRegistry",
      "target": "javascript",
      "kind": "exported-value",
      "code": "dynamic-property",
      "reason": "the declaration contains an unknown value shape that cannot become a precise Haxe surface",
      "sourceInputIds": [
        "browser-runtime",
        "browser-types"
      ],
      "sourceSpans": [
        {
          "inputId": "browser-types",
          "path": "fixtures/adoption-contract/inputs/index.d.ts",
          "startByte": 235,
          "endByte": 298,
          "sha256": "c81db2669f8f9d86f84c80b7285b1c8778c197e29ac77240786730b65ecdead3"
        },
        {
          "inputId": "browser-runtime",
          "path": "fixtures/adoption-contract/inputs/index.js",
          "startByte": 519,
          "endByte": 550,
          "sha256": "853079f4486fd6b8f369c2a27dcfdc9ebf2353cb8cde1a355b8931a7c75b14c0"
        }
      ],
      "signatureSha256": "237652f9444dde2c951b41c547ca0bc21adb6f708d12eaa6270cf23891d765a4",
      "requiredAction": "obtain-authoritative-signature"
    },
    {
      "nativeName": "Acme\\Calendar\\Event::__call",
      "target": "php",
      "kind": "instance-method",
      "code": "magic-member",
      "reason": "the provider does not publish a finite method and return contract",
      "sourceInputIds": [
        "php-stubs",
        "plugin-source"
      ],
      "sourceSpans": [
        {
          "inputId": "php-stubs",
          "path": "fixtures/adoption-contract/inputs/provider-stubs.php",
          "startByte": 174,
          "endByte": 242,
          "sha256": "b14ac9cb6855ca2f2dc2174c5ec1bbf97ffef07a79bff0d87fd2f242178d6a08"
        },
        {
          "inputId": "plugin-source",
          "path": "fixtures/adoption-contract/inputs/plugin.php",
          "startByte": 445,
          "endByte": 517,
          "sha256": "340013659975f2df28b3a74566785f7b2165ce02d14a7db4826a4b85d29ceb8f"
        }
      ],
      "signatureSha256": "723eb294144b92d05aee56ceb0405c0ae140c483ac507a80799c456d3d993789",
      "requiredAction": "omit"
    },
    {
      "nativeName": "Acme\\Calendar\\conditional_helper",
      "target": "php",
      "kind": "function",
      "code": "conflicting-authority",
      "reason": "the authoritative stub and lower-precedence runtime declaration disagree",
      "sourceInputIds": [
        "php-stubs",
        "plugin-source"
      ],
      "sourceSpans": [
        {
          "inputId": "php-stubs",
          "path": "fixtures/adoption-contract/inputs/provider-stubs.php",
          "startByte": 317,
          "endByte": 370,
          "sha256": "0a9663d425af87f55c7db728433e9f188b2d79f39a79aa2a6e865da9a7c01a18"
        },
        {
          "inputId": "plugin-source",
          "path": "fixtures/adoption-contract/inputs/plugin.php",
          "startByte": 885,
          "endByte": 935,
          "sha256": "3b2e9c27852e090b11e10fb11f6592953be80bf2471b90046566f85736ba9c2e"
        }
      ],
      "signatureSha256": "b87a65f61392e941cb1f07d1578794aea3715993304d6915f4b358ad4fdeb9ea",
      "requiredAction": "obtain-authoritative-signature"
    },
    {
      "nativeName": "Acme\\Calendar\\mutate_all",
      "target": "php",
      "kind": "function",
      "code": "by-reference-variadic",
      "reason": "the v1 ABI algebra does not prove variadic reference aliasing",
      "sourceInputIds": [
        "php-stubs",
        "plugin-source"
      ],
      "sourceSpans": [
        {
          "inputId": "php-stubs",
          "path": "fixtures/adoption-contract/inputs/provider-stubs.php",
          "startByte": 372,
          "endByte": 419,
          "sha256": "a0fe155f55593b17d5ccae0d54043c864b75e0cd4b5305ff2dd53a2c5ab85da6"
        },
        {
          "inputId": "plugin-source",
          "path": "fixtures/adoption-contract/inputs/plugin.php",
          "startByte": 966,
          "endByte": 1013,
          "sha256": "dcd217cb9579ec103185b345019a600042c1ca06eab28d5f8b3071b0b32484a0"
        }
      ],
      "signatureSha256": "0e81c1388ac3d43611dbdcacb3d2065ef630a4c8e4b099c32b90fb4376826249",
      "requiredAction": "supply-curated-precise-contract"
    }
  ],
  "conflicts": [
    {
      "nativeName": "Acme\\Calendar\\conditional_helper",
      "strongerInputId": "php-stubs",
      "weakerInputId": "plugin-source",
      "strongerSourceSpan": {
        "inputId": "php-stubs",
        "path": "fixtures/adoption-contract/inputs/provider-stubs.php",
        "startByte": 317,
        "endByte": 370,
        "sha256": "0a9663d425af87f55c7db728433e9f188b2d79f39a79aa2a6e865da9a7c01a18"
      },
      "weakerSourceSpan": {
        "inputId": "plugin-source",
        "path": "fixtures/adoption-contract/inputs/plugin.php",
        "startByte": 885,
        "endByte": 935,
        "sha256": "3b2e9c27852e090b11e10fb11f6592953be80bf2471b90046566f85736ba9c2e"
      },
      "resolution": "omit-binding-and-report"
    }
  ],
  "reflection": {
    "requested": false,
    "executed": false,
    "isolationReceiptSha256": null
  },
  "claims": {
    "evidenceStage": "contract-generated",
    "reviewRequired": true,
    "providerRuntimeTested": false,
    "providerTrustAdmitted": false,
    "productionSupported": false,
    "implementationOwnershipTransferred": false
  },
  "reportDigest": "012eeee7c3231bb603c522710f6e20d7abc9b6c8cdea3fb87e4c9b49eaa709b9"
}
