{"claims":{"evidenceStage":"contract-generated","implementationOwnershipTransferred":false,"productionSupported":false,"providerRuntimeTested":false,"providerTrustAdmitted":false,"reviewRequired":true},"conflicts":[{"nativeName":"Acme\\Calendar\\conditional_helper","resolution":"omit-binding-and-report","strongerInputId":"php-stubs","strongerSourceSpan":{"endByte":370,"inputId":"php-stubs","path":"fixtures/adoption-contract/inputs/provider-stubs.php","sha256":"0a9663d425af87f55c7db728433e9f188b2d79f39a79aa2a6e865da9a7c01a18","startByte":317},"weakerInputId":"plugin-source","weakerSourceSpan":{"endByte":935,"inputId":"plugin-source","path":"fixtures/adoption-contract/inputs/plugin.php","sha256":"3b2e9c27852e090b11e10fb11f6592953be80bf2471b90046566f85736ba9c2e","startByte":885}}],"contract":{"id":"acme-calendar.wp70","sha256":"19b375bbc4f6fcb817d0eca12ec6d25b522eab0ca805e9f09ec0cbe08712f964","version":"1.0.0"},"generator":{"id":"wordpress-hx-adoption-generator","sha256":"3812be8c3e9a993ec7410ea2ced83d4c26df59a7a3064f88e97e0746f4dde1fe","version":"0.0.0-fixture"},"includedBindings":["js.calendar.badge","js.calendar.format-label","php.calendar.event.construct","php.calendar.event.title","php.calendar.list-events"],"omissions":[{"code":"dynamic-property","kind":"exported-value","nativeName":"@acme/calendar.CalendarRegistry","reason":"the declaration contains an unknown value shape that cannot become a precise Haxe surface","requiredAction":"obtain-authoritative-signature","signatureSha256":"237652f9444dde2c951b41c547ca0bc21adb6f708d12eaa6270cf23891d765a4","sourceInputIds":["browser-runtime","browser-types"],"sourceSpans":[{"endByte":298,"inputId":"browser-types","path":"fixtures/adoption-contract/inputs/index.d.ts","sha256":"c81db2669f8f9d86f84c80b7285b1c8778c197e29ac77240786730b65ecdead3","startByte":235},{"endByte":550,"inputId":"browser-runtime","path":"fixtures/adoption-contract/inputs/index.js","sha256":"853079f4486fd6b8f369c2a27dcfdc9ebf2353cb8cde1a355b8931a7c75b14c0","startByte":519}],"target":"javascript"},{"code":"magic-member","kind":"instance-method","nativeName":"Acme\\Calendar\\Event::__call","reason":"the provider does not publish a finite method and return contract","requiredAction":"omit","signatureSha256":"723eb294144b92d05aee56ceb0405c0ae140c483ac507a80799c456d3d993789","sourceInputIds":["php-stubs","plugin-source"],"sourceSpans":[{"endByte":242,"inputId":"php-stubs","path":"fixtures/adoption-contract/inputs/provider-stubs.php","sha256":"b14ac9cb6855ca2f2dc2174c5ec1bbf97ffef07a79bff0d87fd2f242178d6a08","startByte":174},{"endByte":517,"inputId":"plugin-source","path":"fixtures/adoption-contract/inputs/plugin.php","sha256":"340013659975f2df28b3a74566785f7b2165ce02d14a7db4826a4b85d29ceb8f","startByte":445}],"target":"php"},{"code":"conflicting-authority","kind":"function","nativeName":"Acme\\Calendar\\conditional_helper","reason":"the authoritative stub and lower-precedence runtime declaration disagree","requiredAction":"obtain-authoritative-signature","signatureSha256":"b87a65f61392e941cb1f07d1578794aea3715993304d6915f4b358ad4fdeb9ea","sourceInputIds":["php-stubs","plugin-source"],"sourceSpans":[{"endByte":370,"inputId":"php-stubs","path":"fixtures/adoption-contract/inputs/provider-stubs.php","sha256":"0a9663d425af87f55c7db728433e9f188b2d79f39a79aa2a6e865da9a7c01a18","startByte":317},{"endByte":935,"inputId":"plugin-source","path":"fixtures/adoption-contract/inputs/plugin.php","sha256":"3b2e9c27852e090b11e10fb11f6592953be80bf2471b90046566f85736ba9c2e","startByte":885}],"target":"php"},{"code":"by-reference-variadic","kind":"function","nativeName":"Acme\\Calendar\\mutate_all","reason":"the v1 ABI algebra does not prove variadic reference aliasing","requiredAction":"supply-curated-precise-contract","signatureSha256":"0e81c1388ac3d43611dbdcacb3d2065ef630a4c8e4b099c32b90fb4376826249","sourceInputIds":["php-stubs","plugin-source"],"sourceSpans":[{"endByte":419,"inputId":"php-stubs","path":"fixtures/adoption-contract/inputs/provider-stubs.php","sha256":"a0fe155f55593b17d5ccae0d54043c864b75e0cd4b5305ff2dd53a2c5ab85da6","startByte":372},{"endByte":1013,"inputId":"plugin-source","path":"fixtures/adoption-contract/inputs/plugin.php","sha256":"dcd217cb9579ec103185b345019a600042c1ca06eab28d5f8b3071b0b32484a0","startByte":966}],"target":"php"}],"provider":{"artifactSha256":"923412beee77cce43964a12358bb099ac07014bd37973df9910de3ad15b9cabd","id":"acme-calendar","version":"2.4.1"},"reflection":{"executed":false,"isolationReceiptSha256":null,"requested":false},"reportDigest":"8c009eaa4d56056c4a788245ad25cafe9a924fadea68038b35ae48bb29a2469d","reportId":"acme-calendar.review.1","schema":"wordpress-hx.adoption-review.v1","schemaVersion":1,"summary":{"conflicts":1,"discovered":9,"included":5,"omitted":4}}
